{
  "$schema": "../../schemas/render-review.v0.1.schema.json",
  "schema_version": "render-review.v0.1",
  "scenario_id": "compact-three-robot",
  "routes": [
    {
      "robot_id": "R1",
      "cells": [
        {"row": 0, "col": 4},
        {"row": 1, "col": 4},
        {"row": 2, "col": 4},
        {"row": 3, "col": 4},
        {"row": 4, "col": 4},
        {"row": 5, "col": 4},
        {"row": 6, "col": 4},
        {"row": 7, "col": 4},
        {"row": 8, "col": 4},
        {"row": 9, "col": 4},
        {"row": 10, "col": 4},
        {"row": 11, "col": 4},
        {"row": 11, "col": 5},
        {"row": 11, "col": 6},
        {"row": 11, "col": 7},
        {"row": 11, "col": 8},
        {"row": 11, "col": 9},
        {"row": 11, "col": 10},
        {"row": 11, "col": 11},
        {"row": 11, "col": 12},
        {"row": 11, "col": 13},
        {"row": 11, "col": 14},
        {"row": 11, "col": 15},
        {"row": 11, "col": 16},
        {"row": 12, "col": 16}
      ]
    },
    {
      "robot_id": "R2",
      "cells": [
        {"row": 0, "col": 16},
        {"row": 1, "col": 16},
        {"row": 2, "col": 16},
        {"row": 3, "col": 16},
        {"row": 4, "col": 16},
        {"row": 5, "col": 16},
        {"row": 6, "col": 16},
        {"row": 7, "col": 16},
        {"row": 8, "col": 16},
        {"row": 9, "col": 16},
        {"row": 10, "col": 16},
        {"row": 11, "col": 16},
        {"row": 11, "col": 15},
        {"row": 11, "col": 14},
        {"row": 11, "col": 13},
        {"row": 11, "col": 12},
        {"row": 11, "col": 11},
        {"row": 11, "col": 10},
        {"row": 11, "col": 9},
        {"row": 11, "col": 8},
        {"row": 11, "col": 7},
        {"row": 11, "col": 6},
        {"row": 11, "col": 5},
        {"row": 11, "col": 4},
        {"row": 12, "col": 4}
      ]
    },
    {
      "robot_id": "R3",
      "cells": [
        {"row": 14, "col": 10},
        {"row": 13, "col": 10},
        {"row": 12, "col": 10},
        {"row": 11, "col": 10},
        {"row": 11, "col": 9},
        {"row": 11, "col": 8},
        {"row": 11, "col": 7},
        {"row": 11, "col": 6},
        {"row": 11, "col": 5},
        {"row": 11, "col": 4},
        {"row": 10, "col": 4},
        {"row": 9, "col": 4},
        {"row": 8, "col": 4},
        {"row": 7, "col": 4},
        {"row": 7, "col": 3},
        {"row": 7, "col": 2}
      ]
    }
  ],
  "views": [
    {
      "id": "prospective-scc-k3",
      "committed_horizon": 3,
      "route_indices": {"R1": 12, "R2": 13, "R3": 0},
      "prospective_dependencies": [
        {"waiting_robot_id": "R1", "blocking_robot_id": "R2"},
        {"waiting_robot_id": "R1", "blocking_robot_id": "R3"},
        {"waiting_robot_id": "R2", "blocking_robot_id": "R1"},
        {"waiting_robot_id": "R2", "blocking_robot_id": "R3"},
        {"waiting_robot_id": "R3", "blocking_robot_id": "R1"}
      ]
    },
    {
      "id": "prospective-scc-k4",
      "committed_horizon": 4,
      "route_indices": {"R1": 10, "R2": 12, "R3": 0},
      "prospective_dependencies": [
        {"waiting_robot_id": "R1", "blocking_robot_id": "R2"},
        {"waiting_robot_id": "R1", "blocking_robot_id": "R3"},
        {"waiting_robot_id": "R2", "blocking_robot_id": "R1"},
        {"waiting_robot_id": "R2", "blocking_robot_id": "R3"},
        {"waiting_robot_id": "R3", "blocking_robot_id": "R1"}
      ]
    },
    {
      "id": "prospective-scc-k5",
      "committed_horizon": 5,
      "route_indices": {"R1": 8, "R2": 11, "R3": 0},
      "prospective_dependencies": [
        {"waiting_robot_id": "R1", "blocking_robot_id": "R2"},
        {"waiting_robot_id": "R1", "blocking_robot_id": "R3"},
        {"waiting_robot_id": "R2", "blocking_robot_id": "R1"},
        {"waiting_robot_id": "R2", "blocking_robot_id": "R3"},
        {"waiting_robot_id": "R3", "blocking_robot_id": "R1"}
      ]
    }
  ]
}
